IncidentDateTime,City,IncidentState,Country,Shape,DurationSeconds,Comments
30:00.0,orland park,il,us,triangle,900,Orland Park Illinois. July 4th 2003&#44triangular object right over fireworks
00:00.0,san diego,ca,us,disk,900,3 of us saw a copper disk w/ a black solid circle slowly moving in a small clockwise circle tipping on edge showing the top &amp; bottom.
00:00.0,bayonne,nj,us,other,60,observed near the miltitary ocean terminal. flying west to east from across bayonne towards nyc 3 ufo&#39s&#44 two saucer shaped and one slow
30:00.0,mcdonald,pa,us,fireball,60,Glowing object seen in sky over SW Pennsylvania on July 4&#44 2010
00:00.0,knoxville,tn,us,fireball,45,Big reddish-orange (planet-looking) light hovering over Knoxville&#44 TN during 4th of July festivities
00:00.0,rootstown,oh,us,light,600,Orange/Red Pulsating Orb appeared to be viewing neighborhood fireworks display in Porage Co. Ohio
00:00.0,sharps chapel,tn,us,fireball,3600,I along with others saw four red fireball looking things&#44one closely.they were indescrible&#33
00:00.0,st. augustine,fl,us,circle,180,Flying balloon of fire traveling east to west and suddenly turned due south and disappeared.
05:00.0,portland,tn,us,fireball,1200,Flying Fire Ball with no sound high altitude moving from the west to the north.
00:00.0,fort worth,tx,us,sphere,60,Red ball of light hanging in the sky July 4th 2010
00:00.0,russellville,ar,us,light,780,bright orange glow that moved across the tree line for 10 minutes
30:00.0,highland,ca,us,other,300,Low flying military aircraft seen in the area which is out of the ordinary.
00:00.0,fenton,mo,us,light,900,Multiple orange lights/orbs in sky.
00:00.0,irvine,ca,us,unknown,1245,two small red lights going across the skay and never faiding.
00:00.0,lodi,ca,us,other,10800,Not UFO&#44 but lightning can appear identical to sightings and persist for unnaturally seeming long times.
00:00.0,louisville,ky,us,fireball,600,3 orange fireball crafts traveling at an enormous speed but very high&#44 meeting up and vanishing.
00:00.0,louisville,ky,us,light,1800,red light&#44 flying above the fireworks but under the clouds.....
00:00.0,richland,mi,us,fireball,14400,Fire Balls on the 4th of July over Gull Lake in Richland&#44 MI.
00:00.0,st. charles,mo,us,oval,14400,I saw 6 bright yellowish lights flying parole to each other going from south west to north east all going more or less the same speed o
15:00.0,claremore,ok,us,other,10,Looked like  a transparent Squid with paluseing lights.
35:00.0,new smyrna beach,fl,us,oval,240,Orange orb over Atlantic Ocean in New Symnra Beach during unorganized firework show.
45:00.0,fairborn,oh,us,formation,360,Object(s) were stationary&#44 and had an orangish glow to them.
45:00.0,manchester,mo,us,diamond,2,Intense Yellow diamond shaped light over Manchester&#44 MO
47:00.0,vancouver,wa,us,sphere,180,Blueberry Size Glowing Orange Object going East&#44 above the Columbia River at 3500-4000 ft. and a speed of approximately 150mph +.
50:00.0,huntsville,al,us,other,7200,Large orbs moving at a steady altitude and velocity
00:00.0,albuquerque,nm,us,sphere,300,A bright yellow light over Albuquerque on July 4th  1/2 hour before the city fireworks display
00:00.0,baltimore,md,us,circle,60,Circular white light flies over Baltimore on July 4th
00:00.0,bernie,mo,us,light,180,Orange ball of light moving over Bernie&#44 Mo.
00:00.0,bradyville,tn,us,fireball,600,July 4th Glowing Ball Hovers in TN Sky
00:00.0,branson,mo,us,fireball,300,fireball over missouri seen july 4th&#44 2010
00:00.0,carbondale,pa,us,fireball,10800,Orange fireball hovering in the sky&#44 then disappearing
00:00.0,everett,wa,us,light,240,Two orange lights move across the sky over Everett&#44 Washington on the night of July 4th&#44 2010
00:00.0,fridley,mn,us,light,120,Bright red/orange ball of light over Moore Lake (Hwy 65)&#44 for 2-3 min&#44 motionless over tree line&#44 then fades.
00:00.0,garrison,mn,us,rectangle,600,Mille Lacs Lake&#44 Garrison&#44 MN&#44 strange orange rectangle lights seen over lake.
00:00.0,hutchinson,ks,us,fireball,300,Fireball craft
00:00.0,irvine,ca,us,circle,120,Golden Ball in SKy
00:00.0,jefferson,nc,us,sphere,300,Strange round object moving over fireworks display area
00:00.0,johnsonburg,pa,us,fireball,120,Small orange orb slowly moving across the sky
00:00.0,lakeville,mn,us,other,600,Pyramidal-shaped Craft Over Lakeville North High School Field
00:00.0,lexington,mi,us,circle,3600,During firwork show in Lexinton Michigan I noticed a orange cirlce&#44 getting bigger then smaller again.
00:00.0,lombard,il,us,fireball,3600,Possible explanation for some of the July 4 reports.
00:00.0,london,ky,us,circle,1800,Orange UFO passing or hovering through London Kentucky on July 4th
00:00.0,old hickory,tn,us,fireball,600,Six blood red orbs over Old Hickory Tn. dam and dissapears north to Kentucky.
00:00.0,omaha,ne,us,circle,900,Orange lights over Omaha Nebraska.  Not fireworks&#33
15:00.0,orange beach,al,us,circle,240,Set of three lights floating over the Gulf of Mexico
15:00.0,sunrise,fl,us,disk,3600,INCREDIBLE SAUCER-LIKE CRAFT UFO SIGHTING WITH VIDEO EVIDENCE OVER SOUTH FLORIDA&#33
30:00.0,cove city,nc,us,oval,30,green oval light spotted over US-70
30:00.0,trumbull,ct,us,fireball,3,Green Fireball Sighted
40:00.0,williams lake (canada),bc,ca,triangle,1800,we just arrived home about 1 hour ago and im still shaking me and my wife and my 1 year old were returning from a trip and we noticed t
00:00.0,plano,tx,us,triangle,30,V shaped objects&#44 no lights&#44 no sounds
00:00.0,apple valley,ca,us,circle,7200,CIRCULAR CRAFT TURNING AROUND AND MOVING UP &amp; DOWN SIDE TO SIDE W/ FLASHING LITGHS.  ((NUFORC Note:  Capella?  PD))
30:00.0,virginia beach,va,us,,90,Observed a fast moving spherical object moving horizontally across the eastern horizon.
00:00.0,hermiston,or,us,cylinder,600,Call me if you want in depth description and pics and video some in raw format of 4 separate sightings.
00:00.0,hermiston,or,us,fireball,600,2 fireballs and a cylinder shaped craft spotted in Eastern Oregon.
05:00.0,princeton,mn,us,circle,1860,White quick moving light in eastern Mn sky before sunrise.
30:00.0,brecksville (near),oh,us,light,120,As I was heading north on interstate 71 my daughter noticed a amber colored light in the sky... at first it was heading straight in our
30:00.0,new york city (brooklyn),ny,us,sphere,10,Reflective Silver/Orange sphere over Brooklyn
40:00.0,hampton,nh,us,fireball,180,20 plus orange orbs seen in Hampton sky
00:00.0,jackson,wi,us,light,300,Strange bright yellow lights moving across the sky.
00:00.0,severn,md,us,circle,300,12 red lights flying
15:00.0,delhi,ny,us,light,600,I witinessed orange objects flying in unusual patterns coming from the horizon as well a silent and gliding black craft.
20:00.0,el paso,tx,us,fireball,120,Fiery balls falling from the sky over El Paso.
20:00.0,ottawa (canada),on,ca,oval,900,Three orange lighting objects came from south to north at the sky all over Ottawa and went away.
30:00.0,bunn,nc,us,fireball,300,2 fireballs traveling across the sky
45:00.0,eau claire,wi,us,fireball,300,Three groups &#44 each between 5 and 10 objects moved across the sky and disappeared low in sky-Another group appearing shortly after.
00:00.0,kingsport,tn,us,light,300,3 red lights in a triangular pattern rising in altitude together followed by 2 more.
07:00.0,sierra vista,az,us,triangle,10,Triangle-shaped&#44 illuminated object flies fast and silent from north to south across sky
30:00.0,gilbert,az,us,light,600,6-8 Orange lights in formation over Gilbert
30:00.0,jackson,wi,us,fireball,600,Two Unidentified Objects observed over Washington County (Wisconsin)
15:00.0,gilbert,az,us,light,240,12 red lights over gateway airport.  1 light merged with anouther light  and became 1 light.
15:00.0,bethany beach,de,us,sphere,900,Four hovering orange/red fireballs sighted above Bethany Beach&#44 DE&#44 around 10:15pm on Saturday&#44 October 20&#44 2012.
20:00.0,south jordan,ut,us,circle,120,Unexplaned huge red/orange ball over Sandy&#44 Ut traveling horizontally and suddenly dropping out of sight.
30:00.0,cumberland,md,us,light,1800,Hovering flashing object with sudden movement
30:00.0,glendale,az,us,light,300,12 - 20 lights flying in formation in phoenix sky video&#39s linked in full description
35:00.0,scottsdale,az,us,unknown,600,13 orange lighted craft in line formation moving to the North in Northwest Scottsdale Az
45:00.0,lexington,sc,us,light,300,Silent orange balls of light in a straight line formation moving slowly for 5 minutes then dissapeared
00:00.0,anchorage,ak,us,light,1200,3 bright lights (same hew as the stars) darting around the area of the Big Dipper&#44 2 seemed to be &quot;attacking&quot; the 1
30:00.0,snohomish,wa,us,unknown,300,Bright orange thing with beams coming out of it changing colors flying across the sky
00:00.0,toledo,oh,us,light,600,Objects in sky move at incredible speed
10:00.0,salem,nh,us,cigar,10,Metallic object reflecting the Sun&#44 then vanishes.
15:00.0,manitou springs,co,us,circle,60,3ft round silver ball hovering down street and moving in seemingly precise path.
00:00.0,naples,fl,us,unknown,2700,Object moving different directions flashing a powerful bright light then joined by another identical object
20:00.0,levittown,pa,us,light,720,Burnt orange objects in clear sky no navigation lights appeared out of nowhere travel across sky then disappeared.  Levittown Pa.
57:00.0,spokane,wa,us,flash,30,Two small&#44 intense&#44 blinking lights circled above Spokane Valley&#44 WA.  ((NUFORC Note:  Advertising lights??  PD))
00:00.0,germantown,ny,us,light,900,Very large&#44 bright stationary light seen over Hudson River near Saugerties/Kingston&#44 NY smaller lights flying toward it after a time.
00:00.0,philadelphia,pa,us,sphere,3600,Blue white illuminated sphere with smaller spheres orbiting object
42:00.0,woonsocket,ri,us,triangle,300,A flashing triangular object hovering in sky with white beaming lights and body changing color.
25:00.0,levittown,pa,us,light,480,As I was parking in the supermarket parking lot I noticed a orange light that appeared out of nowhere in the sky above the store.
00:00.0,manassas,va,us,triangle,3600,Huge up close triangular craft.
40:00.0,stockton,ca,us,light,960,10/20/13 UFO sighting in Stockton. .?
15:00.0,santa fe,nm,us,disk,300,My sighting in Santa Fe&#44New Mexico
30:00.0,federalsburg,md,us,disk,300,Saucer spotted in Federalsburg MD
30:00.0,baltimore,md,us,disk,900,Oct 1973 Baltimore&#44 Md  Discw/dome/portholewindows/interiorLight.  Noiseless&#44 hovering&#44 close by&#44 huge
30:00.0,baltimore,md,us,disk,480,&quot;Jupiter Two&quot;-like spacecraft&#44 flew noiselessly&#44 slowly just over the field in our backyard.
20:00.0,indian rocks beach,fl,us,light,10,Shooting star stops&#44 reverced direction&#44 loops back and then shoots off into night.
00:00.0,st. george (ut) to las vegas (nv),ut,us,light,1800,A Bright red light in the southwestern sky approx. 45 degrees above the horizon.
30:00.0,orem,ut,us,triangle,120,while noticing the stars over my head disappear in the shape of a triangle three lights became visable and a center docking entrance&#44as
30:00.0,franklinton,nc,us,circle,10,I saw a four foot wide&#44 moving&#44 circular patch of road which was devoid of rain in a driving storm.
00:00.0,rochester,ny,us,disk,600,UFO followed me
20:00.0,utica,ny,us,disk,2100,My private plane was followed by a ufo for over 50 miles.
45:00.0,norristown,pa,us,circle,1200,I viewed three UFO&#39s in the sky&#44 moving at high speeds and amazing shapes in the sky not possible by human planes.
00:00.0,bluff,ut,us,light,60,following a green fireball&#44 a red light appeared on Comb Ridge.
30:00.0,campbell,ca,us,other,600,American stealth and flying sub dissapear into a portal above a house in Campbell ca 95008
42:00.0,columbia,tn,us,formation,6,U-shaped formation of orange gold lights travelling south at high speed.
45:00.0,lakeville (south of twin cities about 15 miles),mn,us,light,73800,Light with green flashing light on bottom&#44 east of me about 10 o&#39clock position over next county&#44 noticed while trying to view northern
55:00.0,kansas city,mo,us,cylinder,1200,I and four other people watched a very large cylinder slowly move across the noon sky and enter a long&#44 narrow cloud through one end&#44 n
00:00.0,tehachapi,ca,us,chevron,900,observed a white object against a blue sky which did not move or behave like an airplane
00:00.0,lancaster,pa,us,light,900,I saw a bright light following me in the sky as I walked my dog.
35:00.0,auburn,wa,us,light,2,I was sitting in the family room of my home with windows facing North toward backyard when my attention was suddenly drawn to a very br
40:00.0,tigard (12 mi so of portland&#44 exit 290 i 5),or,us,light,7200,Object moved north to south approx 40 deg.in 15 sec. and stopped.  Remained in that position till 0130am 11/22/99. at that time i went
30:00.0,waterloo (canada),on,ca,other,10,Crescent shaped object zig-zagging WNW above Waterloo&#44 Ontario&#44 Canada
55:00.0,lynnwood,wa,us,oval,5,dullish orange  orbs with an almost translucent center. Traveling very fast and silent.
50:00.0,cheshire,ma,us,disk,3600,7 light object hovers and moves in a radical fashion.
00:00.0,lodi,ca,us,other,120,3 distinct colored lights hovering over the city in the daytime
00:00.0,spicewood,tx,us,disk,60,Sighting of a color changing UFO in Texas.  ((NUFORC Note:  Report from student.  PD))
30:00.0,los angeles,ca,us,sphere,7,Silver sphere seen near LAX airport out passenger window of commercial aircraft
00:00.0,paoli,wi,us,sphere,30,Metalic aerial object seen from vehicle to the west of Paoli&#44 WI.
01:00.0,montgomery,tx,us,fireball,3,bright white light
30:00.0,georgetown,tx,us,oval,10,Two very bright oval objects at apparent high rate of speed&#44 suddenly disappear
00:00.0,buford,ga,us,flash,14400,strobing lights appear near mall of georgia&#44 go on for hours.  ((NUFORC Note:  Student report.  Possible hoax.  PD))
00:00.0,ocala,fl,us,oval,3,extremely bright and fast shot across east to west lasted 2-3 seconds which tells how fast it really was. no sound.
00:00.0,mckinney,tx,us,other,7200,Five &#39star like&#39 intellegece operated craft observed by 2 people in North Texas.
30:00.0,farmington,mo,us,triangle,300,UFO Sighting - Outside Farmington Missouri.
45:00.0,chisholm,mn,us,triangle,5,Silent&#44 black&#44 triangular object with no lights
00:00.0,hurley (west of),sd,us,other,1800,multiple bright lights and objects that would alternate and fade in and out in a row
30:00.0,stephan,sd,us,light,7200,Bright orange lights dropping &#44 what looked like flares?
00:00.0,monterey,ca,us,light,120,3 very bright white light larger than planets 2 nearby one another 3 a different location i 2 minutes still then completely fading away
40:00.0,cameron park,ca,us,light,300,3 bright stationary lights above hill&#44 low in the sky. Disappeared after about 3 minutes.
00:00.0,hillsborough,nj,us,triangle,300,Silent triangle-shaped craft with bright white lights beneath that flashed on and flashed off.  No sound until slow-moving craft passed
45:00.0,columbus,oh,us,changing,300,White-blue lights over Columbus&#44 Ohio
23:00.0,anacortes,wa,us,light,10,Green Orb does vertical drop&#44 speeds off into oblivion faster than any object I&#39ve ever seen.
30:00.0,edmonds,wa,us,flash,2,Giant flash in sky moving forward and down then disappeared over trees. Not lightening as skies were clear and stars were visible.T
00:00.0,nashville,tn,us,teardrop,5,Nothing like I have ever seen before.
00:00.0,virginia beach,va,us,chevron,300,Bright light seen in Virginia Beach
29:00.0,pomeroy,oh,us,circle,5,The object was green with bright contrail&#44 it moved at incredible rate of speed north to south at aproximateley a 45 degree angle.
55:00.0,knoxville,tn,us,unknown,120,Four short and closely grouped contrails observed in clear skies
45:00.0,sacramento,ca,us,light,30,Two  stationary bright lights in southern sky  observed  30 secs then dimmed and disappeared
00:00.0,granbury,tx,us,circle,300,10/22/08 my husband and myself see a circler object with lights spinning over a lake
00:00.0,charlotte,nc,us,other,300,Strange lights over the highway not a plane or helicopter.
30:00.0,camarillo,ca,us,other,300,Noiseless object flies overhead at roughly 1000-1500 feet.
42:00.0,columbus,oh,us,sphere,5,Bright White Sphere at I-270 and 23 on the south end travelling at an incredible rate of speed
15:00.0,sweet home,or,us,other,40,I dont know what it was&#44 it was like a darker fog surrounded by the lighter fog&#44 then it... blew away. There was no wind that night.
10:00.0,franklin,la,us,oval,180,clear orb with white lights encircling it&#44 the lights were stationary and were not flashing
15:00.0,emmaus,pa,us,unknown,120,A bright light&#44 pulsating&#44 changing color and moving slowing&#44 while coming to a complete stop and then starting to move again.
37:00.0,houston,tx,us,other,600,3 witnesses--object looked like the moon but no moon tonight. I can see it glowing through the trees in neighbors backyard. To high in
45:00.0,west columbia,sc,us,flash,300,Soundless mysterious flashes of light in the southern sky
32:00.0,kokomo,in,us,circle,900,The three bright objects seemed to be fading from dim to very bright for about fifteen minutes&#44 just as we have seen before many times.
20:00.0,los angeles,ca,us,circle,15,I saw a small circular object with bright lights hovering low and very slowly in the air.
00:00.0,brockton,ma,us,triangle,120,Suspected UFO&#44 hovering in an unpopulated area over the tree line.
35:00.0,morongo valley,ca,us,light,600,Blueish/White light seen in Morongo Valley&#44 CA.
00:00.0,brookhaven,ny,us,chevron,10,small v shaped transparent red lights very faint one side of v was shorter than other
05:00.0,luray,va,us,cylinder,300,Bright brilliant orange cylinder object about New Market Gap&#44 with light flying from it and coming back to craft.
39:00.0,glasgow,mt,us,light,10,Intense bright light seen for a few seconds.
00:00.0,monee,il,us,light,600,incredibly bright white solid light that hovered for 5-10 minutes then disappeared
00:00.0,queen creek,az,us,changing,1800,3 White Orbs and bands of 8 Red Lights flash on and off over Queen Creek&#44 AZ
57:00.0,paradise,ca,us,light,15,2 lights&#44 1st one NOT blinking being followed by 2nd one with blinking lights (probable military aircraft)
58:00.0,woodbridge,va,us,circle,10,3 objects over Northern Virginia
00:00.0,green valley,az,us,light,60,Took my dog for a walk tonight on my block. Looked up in the night sky to the North and saw a series of strobe lights stationary in the
00:00.0,kerhonkson,ny,us,changing,900,2 unidentifiable flying objects passsed over our home in Kerhonkson &#44 NY
00:00.0,austin,tx,us,other,1,A crescent shape UFO flying 6&#44000 feet above my head
00:00.0,mount vernon,wa,us,unknown,120,After thinking about this all week&#44 I&#39ve decided to report this. During the 3rd week of November 09 ( I dont remember the exact day) my
20:00.0,ventura,ca,us,formation,7,5 non blinking red-orange lights in V formation zooming silently across the night sky
28:00.0,venice,ca,us,light,15,Coming home from work parking my in the back yard&#44I look up at the sky.At Marina Del Rey&#44 moving north to Santa Monica 4 light triangle
30:00.0,hayward,ca,us,disk,300,I was walking my dogs in the morning and on my way back I saw like a disc object floating in the air. It was like leaning side to side
57:00.0,rochester,mi,us,triangle,180,Black triangle in Rochester&#44 Michigan
00:00.0,athens,ga,us,light,5,Ascending Orange Light
00:00.0,topsail beach,nc,us,sphere,300,brigth orange globe that became four objects.
09:00.0,loxahatchee,fl,us,fireball,5,Consolidated ovoid Fireball&#44 Supersonic speed but without sound&#44 hint of form&#44 3-5 sec duration&#44 stable trajectory PARALLEL to ground
38:00.0,san bernardino,ca,us,light,60,A fast moving bright white object zooms past  ISS
00:00.0,springfield,oh,us,light,5,Bright silver fast moving light in the sky made a quick 180 degree turn&#44 comtrail photographed.
20:00.0,mauston (in country),wi,us,circle,60,3 large spheres in sky merge into 1 and disappear north of the Wi Dells on a country road at dusk.
40:00.0,kayenta,az,us,unknown,2400,UFO lights near Kayenta&#44 AZ
50:00.0,coloma,wi,us,unknown,5,Over a rural road&#44 six horizontal lights appeared low in the sky for a few seconds and disappeared&#44 silently.
00:00.0,berlin,wi,us,circle,120,Row of vertical rectangular lights framed by darkness illuminated a circular matte gray object.
00:00.0,wisconsin dells,wi,us,unknown,5,String of lights
28:00.0,cedar city,ut,us,flash,360,Large String of perfectly spaced strobes flashing in a chaceing pattern along the entire string over Cedar City&#44 UT
30:00.0,cedar city,ut,us,formation,900,String of flashing lights widely spaced moving steadily through western sky from north to south
00:00.0,norman,ok,us,light,5,Small&#44 faintly triangular light seen over east Norman&#44 OK
30:00.0,madera,ca,us,other,30,Large angel hair mass floating above  county road.
45:00.0,freeport,il,us,triangle,15,Totally silent and dark objects flew over my neighborhood 11/16/2011
00:00.0,irvington,al,us,circle,600,Reddish orange lights fading and reappearing in different spots of the sky.
00:00.0,temecula,ca,us,unknown,240,Blacked out Helicopters followed by a strange white light
13:00.0,miami,fl,us,unknown,20,Triangular formation that disburses.
30:00.0,houston (spring),tx,us,cylinder,240,Six elongated lights&#44 cylinder shaped&#44 although actual &quot;craft&quot; could not be seen. NO sound. Smooth travel&#44 no wavering.
30:00.0,west grove,pa,us,circle,10,Craft were in a &quot;V&quot; formation at 10&#44000 feet&#44 and 3 timesw the speed of an airliner.
35:00.0,franklin,tn,us,chevron,2,V shaped blurry craft with lights.  Extremely fast velocity
45:00.0,annapolis,md,us,triangle,10,I saw luminous triangles&#44 flying in formation during the Leonid meteor shower
45:00.0,houston (spring),tx,us,cylinder,120,Large Cylinder with six orange (low-glow) lights moving slowly within 3 miles of IAH&#44 heading toward IAH (Airport)
00:00.0,dickinson,tx,us,changing,3000,single point lite source changing occasionally to bipolar red/azure elongated object rapidly jerking around nite sky
05:00.0,new brunswick,nj,us,chevron,20,Boomerang shaped object over Central Jersey
17:00.0,johnson,vt,us,flash,1,There were tons of meteors out then there was a flash. There was only one flash that I saw all night.
27:00.0,hendersonville,nc,us,sphere,20,Round object-didnt behave like meteor or plane
30:00.0,augusta,ga,us,chevron,60,It came from the north to south.Moveing along the sky. Its movement caught my eye a v shaped bank of lights (white) the same color as t
30:00.0,miami beach,fl,us,sphere,10,this thing was round&#44 metalic&#44fast and had no lights.
30:00.0,naples,fl,us,formation,5,twin orbs cross the entire sky at high altitude in a matter fo seconds (not meterorites)
45:00.0,glendale,az,us,other,600,The lights or fire that were dropping from the bottom were what made it look like something we have never seen.
30:00.0,hamden,ct,us,sphere,180,Observed venus size and color (white) object through binoculars moving slowly accross the sky during day of about 3 minute duration.
00:00.0,cross river,ny,us,triangle,60,The night of the Leonids meteor shower some friends and I (one of which was an Earth Science teacher) were watching the showers in fron
15:00.0,portland (suburbs),or,us,light,900,Two objects joined&#44 then split apart and one released a small light.
30:00.0,highlands ranch,co,us,triangle,240,triangle with one spot on each corner and one big one in the middle.
00:00.0,omaha,ne,us,circle,1200,I was not drinking or anything I know what I saw
00:00.0,lake arrowhead,ca,us,unknown,20,I had been watching the 2002 Leonid meteor shower.  I came back home about 3:15-3:30 a.m. and turned on the NASA TV live broadcast of t
00:00.0,okemos,mi,us,other,10,6:00 am in Okemos Michigan
40:00.0,macomb,mi,us,triangle,120,bright triangular object flying slowly across low evening sky
00:00.0,santa rosa,ca,us,unknown,600,This is the fourth time my family and I have seen this object within the last 12 months. The object was a brilliant orange color. The o
00:00.0,sayreville,nj,us,light,45,2 orange hazes scrambling across the sky.
20:00.0,greenville,nc,us,chevron,120,V shaped object with no sound and colorful lights moving across sky at low altitude.
00:00.0,ashville (2 miles south of),oh,us,light,2,lights during a meteor shower..
00:00.0,houston,tx,us,cigar,60,Large object&#44 no lights&#44 no radar indication in Houston
30:00.0,new york city (staten island),ny,us,unknown,1200,Me and my bro saw alien and ufo at our house
55:00.0,new york city (queens),ny,us,cigar,10,cigar shaped object fling fast near jfk airport
30:00.0,muskego,wi,us,other,600,Cloud cover&#44 very low ceiling&#44 six rings would move around&#44 then move into one ring&#44 then separate&#44 move around&#44 and go again into one
30:00.0,yucaipa,ca,us,light,20,Orbital lights&#44 bright&#44 flashing or stationary
35:00.0,los fresnos,tx,us,sphere,10,Spherical light seen headed due East towards the Gulf Of Mexico.  Extremely fast with no apparent noise sound/emmitted.
00:00.0,fontana,ca,us,changing,30,It looked like a giant jelly fish with little lights all around. and it kept changing it&#39s shape. I looked a lot like the something fro
00:00.0,chillicothe,oh,us,changing,10800,Object changed colors and shapes&#44 divided  at one point ((NUFORC Note:  Sirius??  PD))
45:00.0,pine bluff,ar,us,light,7,light ufo seen on arkansas highway between Little Rock and Pine Bluff appearing to land in nearby woods.
40:00.0,plano,tx,us,formation,10,On September 19&#44 at approximately 4:40 am&#44 my mother and I were outside looking for the Leonid Meteor Shower.  After a while&#44 a V-shape
