IncidentDateTime,City,IncidentState,Country,Shape,DurationSeconds,Comments
02:00.0,morro bay,ca,us,fireball,20,No noise&#44 larger than golf ball sized&#44approximately  1100 to 2200 feet elevation&#44 bright orange&#44 light emmitting in the shape of badmit
40:00.0,murray,ky,us,circle,5,An orange ball&#44 about the size of the moon appeared just above the tree line appear for a few sec.s then disappeared. The object did n
45:00.0,gardendale,al,us,sphere,14400,Up to 9 Objects flying erratically and taking interest in several commercial planes. Birmingham&#44 AL area
00:00.0,blossvale,ny,us,fireball,180,Fire ball chase.
00:00.0,milford,ct,us,other,60,I saw a jellyfish type object hovering. It was pale blue in color and translucent. There was a bright light that looked like a small fl
00:00.0,provincetown,ma,us,light,300,For several minutes the lights hovered over provincetown - everyone on commercial street stopped to look up at the light which moved up
00:00.0,seattle,wa,us,fireball,300,Small orange fireball type object fell to the pavement on Alkai Beach area
00:00.0,syracuse,ny,us,circle,600,Seen 3 orange balls of light. They disappeared and then reappeared. We followed them for about a mile. I video taped it for up to 3 min
10:00.0,frederick,md,us,circle,300,8-12 orangish red circles floating in western sky&#44 slowly disappeared
35:00.0,collegeville,pa,us,light,120,White dot of light traveled across the sky&#44 very fast&#44 then shot away.
40:00.0,bowling green,ky,us,light,120,8-9 Flame colored lights flying in a low formation over Bowling Green&#44 KY.
45:00.0,chicago,il,us,circle,120,Red glowing lights over chicago chased by an airplane.
53:00.0,iowa,la,us,fireball,420,About 20 fireballs going south to north . Filmed about 3 minutes on iphone
00:00.0,farmington,ct,us,circle,900,15-20 similar objects with orange light (no sound) seen moving across night sky from west to south
00:00.0,fredericksburg,va,us,light,21600,Bright light seen in Fredericksburg&#44 Virginia&#33
00:00.0,meridian,id,us,circle,900,More than a dozen red lights travelling slowly towards North and then slowly together up in the sky
23:00.0,canby,or,us,sphere,300,Three amber orbs or spheres.
30:00.0,columbus,oh,us,light,120,Large red light moving very fast from South to North over southern Columbus. Halfway across sky it shrank (maybe changed direction slig
35:00.0,grosse ile,mi,us,fireball,120,Red/orange floating lights/fireball stopped in air than dissapeared.
42:00.0,lancaster county (south of willow street),pa,us,light,20,6 orange/red round orbs/lights going up into south sky over southern Lancaster County&#44 PA 9/14/13 9:45 p.m.
45:00.0,bridgewater,ma,us,fireball,600,Six red orbs in a formations were seen in the sky traveling South. Singulare ords followed for about 15 minutes.
00:00.0,college station,tx,us,light,60,Blue Floating Light
00:00.0,lafayette,in,us,circle,900,Cluster of multicolor stationary lights
00:00.0,landisville,pa,us,oval,360,Fireball.
00:00.0,saint louis,mo,us,disk,600,I sent a similar e-mail to Debbie Ziegelmeyer and Margie Kay (MUFON)but thought I should post it here as well. Maybe there is an explan
14:00.0,columbus,oh,us,light,240,Round orange object spotted over Columbus Ohio
25:00.0,canton,ga,us,fireball,300,Six bright orange fireball like orbs in an arch
40:00.0,o&#39fallon,mo,us,circle,300,About 10:40 pm CST my wife and i saw about 75 plus orange circular objects in the western sky moving slowly west. They were in a zig za
45:00.0,fayetteville,ga,us,light,300,Five bright white lights moving E to W at constant speed and altitude with no similarities to aircraft.
00:00.0,ashville,ny,us,cone,900,Flashing Craft over Chautauqua&#44 NY
00:00.0,hamilton,oh,us,fireball,1800,15 fireballs in sky moving at a good speed.
10:00.0,lakehurst,nj,us,fireball,1800,Two high intensity orange glowing balls of light appearing and reappearing across the sky.
40:00.0,lock haven,pa,us,rectangle,30,Black rectangle heading westward.
30:00.0,lynch station,va,us,light,600,Silent bright craft releases smaller craft in 1976.
00:00.0,sacramento,ca,us,oval,360,In September 1976&#44 I had another UFO encounter.  This time I was out of the Army and living with my former girlfriend H. L. in an apart
00:00.0,hoodsport,wa,us,,120,Heard Strange sounding flying object above tree tops
00:00.0,beatty,or,us,light,480,A bright object flying in the sky turned 90 deg on the fly came toward us then glowed brightly for maybe 8 min then flew away from us a
44:00.0,alhambra,ca,us,disk,1200,&quot;People of Earth; unite and love each other&quot;
00:00.0,knoxville,tn,us,disk,300,Two disc shaped objects flying in tandem
00:00.0,dublin,nh,us,triangle,600,There were six of us. We were on the &quot;Upper Field&quot; of our prep school where there were no outside lights. The night sky was bright (goo
00:00.0,heber,az,us,triangle,10,Witnessed an enormous black triangle with lights traveling overhead&#44 at a very low altitude at night in a remote area.
00:00.0,childs (near the verde hot springs),az,us,,5400,I have been trying to get more info for you on this siting.It was reported in the Verde Independent newspaper in Cottonwood&#44Az.&#44but the
00:00.0,wells,me,us,triangle,60,huge&#44 diamond shape object flying low  in southern Maine
00:00.0,flemington,fl,us,oval,420,This incident is my very first of two in my lifetime I have witnessed and happened when I was 18 which was a little more than 30 years
00:00.0,covington,wa,us,disk,600,1978 Covington&#44 WA Disc-shaped Object
00:00.0,pampa,tx,us,light,600,Had UFO come within 30 to 40 feet from us. Then took off very very fast into space. No doubt there is other life out there&#44 none at all
00:00.0,braceville,oh,us,diamond,900,It was over 28yrs. ago now&#44  and I can remember it like yesterday.
30:00.0,edmundston (canada),nb,ca,disk,3600,After witnessing a ufo&#44 with my family&#44 I beleive that my mother and myself were abducted the next night.
00:00.0,shelby,oh,us,triangle,600,Triangular&#44 slow moving object with no lights and very low altitude outside of Shelby
00:00.0,bryan,tx,us,oval,1200,Shining Bright Light&#44 Oval Shaped&#44 no sound
30:00.0,maynardville,tn,us,light,120,A late night viewing of a bright&#44 white light during a camping trip leads to an unusual physical manifestation.
30:00.0,royal oak,mi,us,disk,1200,after leaving work at (15 mile and Crooks Rd)about 12:30am I travaled south on Crooks Rd for about 15 mts stopping for a red light at C
00:00.0,southwest harbor,me,us,light,300,Large round white light
00:00.0,elko,nv,us,light,15300,Spotted aluminum-colored square- shaped blinking lights which disappeared&#44 car stopped &amp; red/orange ball followed us.
00:00.0,tekamah,ne,us,unknown,480,Standard running light&#44 hovers&#44 flies slow&#44 climbs fast and absolutely no sound and no jet engines flames.
00:00.0,bridgeport,ct,us,triangle,300,I was sitting on my front porch and noticed a bright light in the distance over the trees. I mentioned it to my fiance and he said it w
30:00.0,georgetown,sc,us,triangle,180,Triangular shape over Georgetown&#44 early 1980&#39s
30:00.0,bryan,tx,us,other,900,cant describe what I saw? And when I try something deep inside tells me not to&#33&#33&#33 sorry.....
30:00.0,trenton,mo,us,rectangle,3600,Soundless rectangle Trenton&#44 Missouri.
30:00.0,star junction,pa,us,circle,1800,Crafts seen by many in PA media covers
00:00.0,richmond (canada),bc,ca,light,2400,Light witnessed first on ground or o horison moving back and forth for a long duration. The light then paused for a moment. and then as
00:00.0,la crosse,wi,us,disk,1200,I saw a disk hoovering over a Parking lot with aprox 30 others.  Lights revolving around it.  Motionless.
42:00.0,lexington,sc,us,disk,5,Disk
40:00.0,pittsburgh,pa,us,fireball,1200,Second sighting of orange orbs with green/blue lights since June 2012.
00:00.0,myrtle beach,sc,us,circle,1500,Orange lights were seen hovering over the ocean. These lights created lines of upto 4 lights then quickly dissipating.
00:00.0,myrtle beach,sc,us,fireball,240,Fiery ball of light slowly growing bigger then fading away all in sequence in triangular formation with other lights.
00:00.0,ocean isle beach,nc,us,circle,3600,Red/Orange lights over Ocean Isle Beach&#44 NC.
00:00.0,sunset beach,nc,us,other,2700,Strange noises
30:00.0,cherry grove beach,sc,us,oval,1200,Orange balls of light appeared in sky above the ocean and darted from left to right.
30:00.0,myrtle beach,sc,us,light,30,Bright orange lights appeared above the horizon&#44 only to disappear&#44 then reappear in formation.  Lasted about 30 seconds.
40:00.0,myrtle beach,sc,us,unknown,120,Observation&#44 numerous times&#44 orange lights to the East of Myrtle Beach&#44 SC.
45:00.0,myrtle beach,sc,us,circle,900,Lights over Atlantic Ocean during evening&#44 easily seen&#44 quickly disappearred&#44 several locations
00:00.0,lampasas,tx,us,light,15,Sequential lights in straight&#44 horizontal lines in the sky over Texas.
00:00.0,villa hills,ky,us,flash,3600,West of Cincinnati UFO sighting.
30:00.0,brownwood,tx,us,light,1800,Orange glowing lights above walmart
30:00.0,grand junction,co,us,unknown,300,No lights&#44 quiet&#44 hovering &amp; stationary.
00:00.0,inman,sc,us,disk,10800,A saucer shape UFO was seen outside of my friends house&#44 flying in all different directions that no plane can fly&#44 and lasted 3 hrs.
00:00.0,little river,sc,us,light,120,A pair of bright lights changed into bright organic lights like fire lights that went miles in seconds&#44 no sound.
22:00.0,montreal (canada),qc,ca,changing,3,Falling light with a changing shape in rotation.
30:00.0,jenks,ok,us,circle,600,Two blinking circular crafts hover over northern sky and then vanish.
45:00.0,glenford,oh,us,unknown,180,Light in the sky
45:00.0,pasadena,ca,us,fireball,3600,Mass UFO sighting: Pasadena&#44 CA: 4:35pm on December 24&#44 2013.
00:00.0,erial,nj,us,sphere,3,Shiny spherically shaped object traveled very quickly southeastward then disappeared after a few seconds..
10:00.0,columbia,md,us,diamond,20,A low diamond shaped flash of light that started blue and turned white like a bright shooting star over Sewells Orchard Pond.
19:00.0,richmond,va,us,circle,2,Blue and green circle took off in two seconds and then was gone.
30:00.0,morristown,nj,us,light,3,Bright fast quick light streak.
30:00.0,dallas,tx,us,circle,2,Shiny circular object in sky&#44 no lights&#44 Extremely shiny. Disappeared a few seconds after I saw it.
00:00.0,woodbridge,va,us,cigar,300,silver cigar shaped craft NO WINGS
55:00.0,hogansville,ga,us,circle,120,Early afternoon sighting&#44 made 90 degree turns
00:00.0,bellingham,wa,us,light,18000,Large star like light hangs in the sky for over 5 hours &amp; disappears.
45:00.0,dahlgren,va,us,light,60,Lightes orb seen failing during the day.
30:00.0,arnold,md,us,fireball,5,Extremely bright ball/circle of yellow-white light surrounded by a red outline streaked across evening sky
10:00.0,west vancouver (canada),bc,ca,light,600,Solid white light over Vancouver BC moving due south.
15:00.0,cedarville,ca,us,light,3600,Small red light followed by orange orbs that appeared&#44 multiplied&#44 and disappeared.
30:00.0,st. louis,mo,us,triangle,60,Delta shaped object hovering over flatbed truck in St. Louis.
40:00.0,lakeland,tn,us,light,30,Light seen makes a turn and disappears.
45:00.0,brothers,or,us,light,2700,I saw two groups of lights that appeared to be separate craft.
45:00.0,edgewater,md,us,light,60,Saw two stationary lights in the southeastern sky for about 1.5 minutes very brilliant light and then faded away.
00:00.0,garland,tx,us,circle,600,6-8 orange/yellow circles hovering in a zigzag formation.
00:00.0,plainview,ny,us,triangle,3600,4 lights in the shape of a triangle were seen in the night sky.
15:00.0,eugene,or,us,other,300,Bright orange light&#44 flying low&#44 moving slowly &amp; was silent
15:00.0,mitchell,sd,us,light,15,Orange light that fades out and reappears.
35:00.0,o&#39fallon,mo,us,triangle,120,silent slow obtuse triangle&#44 all black with perimeter white lights
50:00.0,wilkes-barre,pa,us,other,360,Flashing lights Red/Orange and White/grey &quot;bouncing&quot;  gaining and losing altitude instantly.
00:00.0,broken arrow,ok,us,oval,900,2 Orangish/Red/Yellow Oval Objects hovering over a Broken Arrow&#44 OK residential district.
00:00.0,chandler,az,us,disk,20,Craft moved from West to East across South Chandler sky.
00:00.0,rosamond,ca,us,formation,9,Witnessed two red steady lights moving west to east in a straight line across night sky. Faster than a plane&#44 but not as quick as a sho
38:00.0,new castle,pa,us,fireball,300,((NUFORC Note:  Witness provides no information about sighting.  PD))
30:00.0,irving,tx,us,cylinder,240,Triangular object with faint yellow-orange lights on irregular flight path hovered&#44 then descended rapidly and observed as cylindrical
30:00.0,ogilvie,mn,us,light,900,Orange light above trees.
40:00.0,waterloo,ia,us,triangle,60,Triangular aircraft with yellow and red lights.
45:00.0,mansfield,tx,us,triangle,5,white 500 foot wide V shape craft flys over Mansfield&#44 Texas at night
00:00.0,toledo,oh,us,triangle,900,Black triangle slowly flew over us&#44 almost silent&#44 and directly changed course&#44 descended into wooded area
30:00.0,brandon,ms,us,circle,10,Bluish green object&#44 the size of a dime held at arms length traversing approximately a 10 degree path toward the southwest horizon.
00:00.0,terrebonne,or,us,unknown,120,Piercing&#44 shrill tone.
00:00.0,springfield,ma,us,disk,300,Unexpected siting of a disk shaped object fully illuminated by bright&#44 circling lights around this object
00:00.0,erie,pa,us,circle,1200,bright circular object along Lake Erie
00:00.0,wellsville,ny,us,disk,600,Object seen hovering nearby. Very bright lights through ports.
25:00.0,muscatine (area approx. 7mi south),ia,us,circle,12,A formation of approx. 16 round fire orange guided craft entered the western sky at &quot;10 o&#39clock&quot; attitude. As I was watching the clear
30:00.0,christmas valley,or,us,formation,300,Strange incident in 1977
00:00.0,virginia city,mt,us,other,600,While elk hunting South of town I sighted a huge object which was shiny like mylar or a mirror but seemed metalic. It was shaped like a
00:00.0,monroe,nc,us,disk,300,Coming home from grocery store on a brisk fall evening I noticed something in the sky to the NW of our location. Stopped car to take pi
00:00.0,california valley (cattle country&#44 not too distant airbase),ca,us,disk,300,Played with our car for over 5 min. deserted freeway&#44 took off like slingshot returned and put bright light on car&#44 only time made nois
55:00.0,orange,ma,us,diamond,60,Flying object from north orange down east rd.
00:00.0,hawthorne,ca,us,triangle,1200,In 1985 during a meteor shower asked object to come my way if not a plane&#44 and it did.
00:00.0,north hollywood,ca,us,sphere,18000,4 luminous white balls rotating above our house.
00:00.0,miami,fl,us,light,60,They disappeared behind the only cloud in the sky.
45:00.0,endako (canada),bc,ca,unknown,1500,HBCCUFO CANADIAN REPORT:  Unusual object which was flying low and parallel to their vehicle along Highway #16.
30:00.0,san antonio,tx,us,other,20,amorphous&#44 floating ink-spot in the night sky
00:00.0,center valley,pa,us,triangle,600,Grey Triangular object about 25-30&#39 wide with three very bright white lights&#44 one in center and one on each wing tip&#44 moving at no more
00:00.0,north pole,ak,us,light,15,It was late at night and me and my mother were taking our dog out. It was late at night so the sky was almost pitch black with but a fe
00:00.0,sacramento,ca,us,disk,2,Planes flew by and as I was watching them pass I saw a saucer with another smaller saucer on top. At first I thought it was clouds and
00:00.0,butler,pa,us,light,120,Faint Blue Light Moving and Disappearing.
15:00.0,beverly hills,ca,us,circle,60,Slow moving bright orange fireball appearing somewhat close. Direction unclear&#44 then suddenly disappears.
17:00.0,salt lake city (cottonwood heights),ut,us,sphere,180,Bright green basketball sized orb dashed next to me&#44 then up to the sky.
15:00.0,wellington,co,us,unknown,2700,Red&#44 white and blue flashing lights in the Northern sky above Wellington&#44 Colorado.
00:00.0,elkton,md,us,other,1800,Object in Elkton sky with flashing orange lights&#44 just floating/hovering. Looked like a planets or star but def not.
00:00.0,milwaukee,wi,us,circle,120,Reddish orange lights floating in the sky from west to east
30:00.0,flushing,mi,us,oval,600,3 small white circling very fast in oval formation for 10 minutes.
00:00.0,baltimore,md,us,formation,600,Baltimore MD BWI a formation of more than 20 orange lights strung across the eastern horizon at a elevation of 35 degrees
00:00.0,des moines,ia,us,triangle,10,Large low-flying craft with orb like lights in a cross shape.
00:00.0,morris,il,us,unknown,2400,ufos over i80 between morris and bolingbrook illinois.
15:00.0,katy,tx,us,fireball,180,Fireball seen moving across the sky of Katie&#44 Texas. .
15:00.0,pittsburgh,pa,us,disk,420,Saw 2 disc shaped white-ish blue objects floating in the clouds at night moving Around in very eratic movements. Circular zig zaging et
27:00.0,ellicott city,md,us,circle,120,((NUFORC Note:  Witness provides no information; remains totally anonymous.  PD))
30:00.0,lake lure,nc,us,light,900,Bright orb that disappeared as I was watching it.
30:00.0,nampa,id,us,disk,27,Oct 25 2013 approximately 20:30 hrs.  Bright star appearing light low on the horizon (not seen in the past) observed on and off for .45
00:00.0,meridian,id,us,disk,900,I saw military planes go after it&#33
00:00.0,sarasota,fl,us,rectangle,60,5 good sized orange to white rectangular to oblong moving objects
40:00.0,centerville,oh,us,fireball,600,75+ red dots  in the sky over Dayton&#44 Ohio
00:00.0,playa del rey,ca,us,flash,120,Huge unexplained flashing lights on the sky in Los Angeles near Playa Del Rey
15:00.0,loganville,ga,us,triangle,1800,Roughly 25 triangular foreign objects with red cores; all came from the south and dissappeared to the north.
15:00.0,waukee,ia,us,circle,420,Multiple bright yellow-red circular lights sighted travelling SW to NE over Waukee towards Des Moines.
30:00.0,seaside park,nj,us,cross,30,Additional Info for the Friday Oct. 25th 10:30PM Sighting of 2 UFOs in Seaside Park NJ off the Ocean front.
55:00.0,milford,oh,us,circle,600,6 orange lights moving at high rate of speed
00:00.0,jackson,wi,us,formation,60,3 reddish orange objects spotted in formation.
00:00.0,newport beach,ca,us,changing,150,Object defies physics in Newport Beach&#44 CA.
30:00.0,marksville (spring bayou&#44 1st landing),la,us,triangle,300,Triangluar object moved very slowly over the trees appr. 100 yards from me without a sound&#44 stopped&#44 tipped up and lowered itself into
00:00.0,charlotte,nc,us,triangle,2,I spotted two triangular craft over the treetops........
30:00.0,marina del rey,ca,us,,120,I hung up the phone with a friend and went to bed. I had pulled the covers around my shoulders and my eyes were closed. With closed eye
23:00.0,kaufman (outside of),tx,us,light,35,Large oval light&#44 with smaller red light on top that was not blinking&#44 in northern skies.
50:00.0,pewaukee,wi,us,fireball,30,three blue green firebals falling.
45:00.0,buckeye,az,us,light,2400,THERE WERE 3 CRAFT....ONE SEEMED TO BE IN THE LEAD WITH THE OTHER TWO SLIGHTLY BEHIND IT HORIZONTAL TO EACH OTHER...WE COULD NOT MAKE O
30:00.0,longville,la,us,changing,300,AS WE WATCHED THE RED LIGHT MOVING IT SUDDENLY TURNED TO A FIREBALL&#44 THEN SEPERATED INTO TWO RED LIGHTS THAT FLEW IN 2 DIFFERENT DIRECT
00:00.0,aurora,co,us,triangle,600,Triangular craft (two footbal fields in size)
30:00.0,greeley,co,us,triangle,10,It was large&#44 moved slowly and was silent.
30:00.0,anchorage,ak,us,light,28800,Missing time ........ Why is it 7:45 am &#44 when I just looked at the clock and it was 1:15 am a second ago?
30:00.0,woodbridge,va,us,rectangle,28800,Two red lights&#44 flying in a circular pattern with several repetitions over a period of at least a half hour.
30:00.0,kountze,tx,us,light,2400,UFO seen by 3 over Texas
00:00.0,potomac,md,us,light,60,STEADY RED LIGHT GOING EAST TO WEST
00:00.0,clarksville,ar,us,cylinder,60,Two of us observed a shiny&#44 silent&#44 cylindrical craft at 5000 feet or less on October 26.
40:00.0,adams,tn,us,disk,120,Silver disc the width of the jet stream of a jet appeared between two jets heading for each other.
00:00.0,tulsa,ok,us,light,180,2 bright lights with sparkling trails moving in figure 8 pattern
45:00.0,burbank,ca,us,other,5,Fireball over San Fernando Valley&#44 CA
45:00.0,santa monica,ca,us,light,60,something with lights giving off sparks and then disappeared into the night
50:00.0,buford,ga,us,flash,20,Sky fire  burning contrail.
00:00.0,roanoke,va,us,other,600,Jackrock shaped object seen in broad daylight
30:00.0,phoenix,az,us,cigar,2,Photo of UFO in Phoenix Arizona&#44
45:00.0,south pasadena,ca,us,other,60,It was blue&#44 crescent-shaped&#44 and wobbling from side to side.
30:00.0,garrison,ny,us,light,600,Possible UFO sighting in Garrison New York
00:00.0,los molinos,ca,us,triangle,10,A large &quot;V&quot; shaped object passed overhead&#44  it flipped or banked&#44 then disappeared.
30:00.0,maud,ok,us,unknown,180,object moved from south to north but had an unusual vertical bobbing action to it.
20:00.0,allen,tx,us,unknown,120,this afternoon while sitting outside on my patio&#44 I saw it again&#44 last week I saw it and now again&#33&#33 it is like the shape of a boomeran
25:00.0,vernon (canada),bc,ca,other,300,I was standing behind my car&#44 waiting for a phone call and I looked up to the clouds and notice a white dot moving at a slow pace. I wa
30:00.0,stevens point,wi,us,circle,300,I observed a circular yellow-orange-red flashing light go above the tree line straight east of Wal-mart at Hwy 10 and Brilowski Road
35:00.0,york,pa,us,triangle,60,out side with sons&#44  3 large trangle shape&#44 each with 3 red trangle shapes under body. made no sounds&#44 moved slow going east to west.
30:00.0,lake hiawatha,nj,us,light,5,A flying yellow silent explosion-esque shape&#44 faster than any plane I&#39ve seen.
30:00.0,o&#39fallon,il,us,other,180,I am now a believer in UFO&#39s because of my experience with a Green object last night.
00:00.0,staunton,va,us,cigar,5400,Cigar w/ two lights (--).  Staunton&#44 VA
00:00.0,lewiston,me,us,light,7200,A light in the sky similiar to Haley&#39s comet during sunset 10/26/04 Tuesday evening around 18:00 hours  ((NUFORC Note:  Star??  PD))
35:00.0,keene,nh,us,flash,5,Looked like plane or scud missle shot down.
00:00.0,lansing,mi,us,other,15,____________ \__________ it looked like this formation with about 9 lights... it went very fast was pretty close down to the earth. My
00:00.0,vya,nv,us,fireball,600,Multiple Fireballs in the sky
45:00.0,tracy,ca,us,oval,900,it was an oval shape brighty lit no sound blinking lights underneath
39:00.0,wichita,ks,us,light,15,Light near Witchita&#44 KS
00:00.0,orlando,fl,us,cigar,300,Cigar shaped bright aluminum craft appeared in the north west sky at an elevation of about 35 degrees.
30:00.0,martinez,ga,us,light,10,Light spotted over Martinez&#44 GA in middle of day.
00:00.0,lexington,sc,us,circle,1800,Three aircraft hovering in different locations for long period of time.  Alternating green&#44 white&#44 red lights.
00:00.0,aberdeen,wa,us,fireball,120,well this the first time to this site but after seeing the reports of the same sighting i need to report this.  at about 10pm i was doi
00:00.0,clarendon,ny,us,sphere,300,glowing sphere and small sphere seen&#44 thought it was another plane crashing after September 11th.
30:00.0,rancho cucamonga,ca,us,fireball,540,Pulsing orange light&#44 hovering&#44 sparking&#44 and dimming until fading completely.
30:00.0,shorewood,il,us,disk,30,Very large disk with a blue light on the bottom and 2 or more red lights on the sides. Made no noise whatsoever.
20:00.0,huntington,in,us,unknown,30,It sounded like a slow moving propeller&#44 with humming noises and a louder static-electricity zapping sound.
00:00.0,bertram,tx,us,egg,1800,Egg shapped craft&#44 leaving trail of spider web like material
45:00.0,austin,tx,us,fireball,3,&quot;Comet Like&quot; Blue/Green streak before dusk.......
38:00.0,chandler,az,us,diamond,15,The object appeared to be a dimmly illuminated flying wing approximately diamond shaped with squared off wing tips.
30:00.0,brown city,mi,us,circle,300,It was a lighted flying object that flew at a high rate of speed and was able to manuever unlike anything I have ever seen&#33
15:00.0,thomson,ga,us,flash,5,I&#39ve seen a bright flash of light three times in the same area.
34:00.0,vancouver (canada),bc,ca,light,2,This Object was no sattellite&#33
15:00.0,tallahassee,fl,us,sphere,30,flash of light&#44 great speed&#44 rounded turn/change of course&#44 abrupt full stop
45:00.0,alpharetta,ga,us,sphere,30,Tarnished bronze sphere hovering in close proximity to a radio tower
50:00.0,russellville,ar,us,triangle,60,Three Lights Form Triangle in Sky Near Russellville&#44 AR on Evening of 10/29/03
55:00.0,rayne,la,us,light,180,THERES SOMETHING WEILD GOING ON UP THERE &#33
15:00.0,powder springs,ga,us,light,900,Very Bright Blue Star
49:00.0,miami,fl,us,other,5,An irridescent boomerang shaped object in the western sky&#44 and five minutes later it came back moving the same direction
00:00.0,palatine,il,us,unknown,2,Booms associated with Bartlet sightings 10/29/03.
15:00.0,bartlett,il,us,light,2700,Mysterious white orbs in night sky - moving in a repetitive sequence - within the same circular area - which stayed in the same spot .
00:00.0,new iberia,la,us,cigar,5,Very bright object along busy highway
50:00.0,scipio center,ny,us,other,180,A flying pea pod with four lighted peas on top.
