IncidentDateTime,City,IncidentState,Country,Shape,DurationSeconds,Comments
15:00.0,yellowknife (canada),nt,ca,oval,480,Twilight sighting of bright&#44 glowing&#44 red&#44 oval and moving object in northern Canada.
00:00.0,hartford,ct,us,,60,2 very unusual possibly related events correspond  in time with no explanantion in Connecticut.
10:00.0,palm desert,ca,us,other,600,Saw a luminous yellow-green color craft&#44 with external white lights.  It was quite large.  It was low on the horizon&#44 so low that it wa
00:00.0,reading,pa,us,disk,5400,Disk&#44 blue and red lights&#44 stationary in the southeast for 90 mins. Disappeared when aircraft approached
45:00.0,levittown,pa,us,triangle,1800,bright lights in the sky
00:00.0,league city,tx,us,triangle,2,I saw a triangular shaped craft outlined in lights hovering over the highway that I was traveling on low &amp; in front of me.
30:00.0,myrtle beach,sc,us,light,120,Three big orange lights sat in the sky then vanished
30:00.0,pennsauken,nj,us,triangle,180,suspicious   moving lights no sounds  in the sky   to close to the ground
30:00.0,shattuck,ok,us,fireball,3,It was a  fast blue&#44 green and white ball of flame shooting from east to north&#44 that then just was gone.
15:00.0,temecula,ca,us,circle,3,blue circle over the skys of temecula flashed and never seened again
20:00.0,clover,sc,us,unknown,600,Craft sighting in SC. Complex lighting system and lack of conventional engine noise.
00:00.0,brewster,oh,us,other,5,It was loud and fast and had lights spinning around it.
08:00.0,bloomsburg,pa,us,unknown,600,I saw a set of lights in the sky that hovered above the road and then dissapeared
30:00.0,hope,nd,us,unknown,120,Large bright orange light moving to the south changed to green and disappeared into the northern black sky.
40:00.0,west warwick,ri,us,unknown,1200,Sighted three white to bluish lights that came to a stationary halt -watched for 15 min. &amp; fell asleep.
00:00.0,seattle,wa,us,unknown,300,Abduction
00:00.0,tunkhannock,pa,us,light,7200,Flashing colors appeared to be spinning
45:00.0,harrisburg (in general area of),pa,us,oval,600,Pink aura flying below cloud cover.
00:00.0,columbia,mo,us,triangle,300,Triangular craft with three lights seen at night on Broadway Blvd. in Columbia MO
00:00.0,bozeman (gallatin range),mt,us,oval,60,Flash of light stops above the Gallatin Range hovers and then disappears to the south
00:00.0,lafayette,co,us,triangle,10,I completed a report on your site over a year ago and it was very brief and not as descriptive as I should have been in my initial repo
00:00.0,lafayette,co,us,triangle,7,I was at a friend&#8217;s house in Lafayette Colorado to watch the predawn Meteor Showers at 4:00am. We were standing outside having a smoke
00:00.0,lake george,ny,us,formation,180,I have on video a bright light above French Mountain that hovered for several minutes of which I have few minutes on video. The bright
50:00.0,st. petersburg,fl,us,oval,300,we were watching the east sky from my st. Pete home over the trees but far&#44 we assume it was planet mars&#44 it was not moving then&#44 it wa
40:00.0,old lyme,ct,us,circle,180,spots in the sky that appear suddenly and disappear just as suddenly ... photographed
00:00.0,lafayette,tn,us,cylinder,900,Three UFO&#39s appear out of thin air for 15 minutes then vanish.
00:00.0,benton,ar,us,light,2,Bright lit aircraft descends&#44 and vanishes without a trace.
00:00.0,gainesville,va,us,light,900,Spectacular Lights seen to separate in Virginia outside Washington DC
00:00.0,winchester,va,us,formation,3600,Strange Formation
30:00.0,mechanicsburg,pa,us,unknown,600,Bright flashing object moves silently above Mechanicsburg&#44 PA&#44 with erraitc cursive-like motions.
00:00.0,elkhart,in,us,diamond,300,A red red sphere folllowing a blinking diamond shaped thing.
25:00.0,davie (shenandoah area),fl,us,fireball,60,Three dark orange or reddish colored objects flying in a triangular pattern over Davie
35:00.0,east norwich,ny,us,oval,1,High speed object with bright green light over Nassau County NY
00:00.0,mason,oh,us,circle,1200,didnt move like a plane or helicopter&#44 too close to be a star.
15:00.0,renton,wa,us,flash,1,flash of light moving toward lake washington
30:00.0,selden,ny,us,light,45,at 5:30 on 1/3/11 &#44 i was walking my dog faceing north when i saw a flash in the sky.I saw a star moving from north to south .as it mov
40:00.0,fairless hills,pa,us,unknown,360,1 Bright white dot&#44 eventually ended up being 6 in 2 same shaped triangles
30:00.0,denver,co,us,sphere,420,Two orbs&#44&#44&#44one in Denver&#44&#44&#44&#44one in San Diego
50:00.0,yankee hill,ca,us,light,300,Thought it was a bright star at first.  Then the light moved down close to the trees.  It moved around the mountains for about 4 to 5 m
00:00.0,lancaster,ca,us,other,40,object moved in matter of seconds from east side of the sky to west side of the sky a distance of 2miles
30:00.0,san jose,ca,us,circle,1,It was 1 : 30 pm  me and my wife where standing outside of our apartment when we see 3 flying object very high in the sky  we stayed wa
00:00.0,ventura,ca,us,chevron,1200,A slow rising black boomerang shaped object&#44 it had no trail and no lights.
00:00.0,concord,ca,us,triangle,120,Red blinking black triangle spotted over highway 24 downtown plesant hill/ geary exit CA
40:00.0,bullhead city,az,us,sphere,40,emtying the trash  looking west over our western mountain range i saw what  i thought was  a jet departing from laughlin  airport. as i
40:00.0,glen spey,ny,us,flash,2100,colorful flashing craft hovers for 30mins &amp;  then flashes violet&#44 followed by dashing to the right &amp; disappearing
28:00.0,reedville,va,us,changing,3600,Spherical flashing lights&#44 hovering in the northwestern sky&#44 no sound.  ((NUFORC Note:  Possible sighting of celestial body??  PD))
40:00.0,whittier,ca,us,light,3,Thick bright light travels across southern California then disappears?
00:00.0,ben wheeler,tx,us,light,180,Very bright light&#44 flying lower than a jet; appeared to be tracking another light.  ((NUFORC Note:  Satellites??  PD))
00:00.0,san pablo,ca,us,unknown,14400,Extremely high&#44 hovering object blinking various colors with red light on top seen from San Pablo.  ((NUFORC Note:  Sirius??  PD))
10:00.0,cedar rapids,ia,us,light,900,Two very bright white lights come close together in the northwest sky and one dissapears...
30:00.0,sand springs (west of),ok,us,circle,45,Orange glowing  round object seen in the sky just 2 miles of Lake Keystone&#44 Sand Springs&#44 Oklahoma
00:00.0,lebanon,mo,us,other,10,it was  very fast yet vivid
50:00.0,vincennes,in,us,triangle,180,I witnessed a short-duration&#44 triangle-shaped UFO in Vincennes&#44 IN on Tuesday 01/04/11 at 2:50 a.m.
30:00.0,southbridge,ma,us,light,20,Went outside before dawn&#44 was watching the sky and noticed an object the exact shape of a star traveling across the sky into the dark.
15:00.0,woodward,ia,us,fireball,300,Orange/gold lights that seemed to &quot;leap frog&quot; across the north western Iowa sky.
58:00.0,holts summit,mo,us,disk,240,Heard it 11-25-10 Saw it 1-4-11.
00:00.0,topeka,ks,us,oval,2400,Two different air-ships that traveled through a  city and traveling so low and making  no noise at all.
40:00.0,moultrie,ga,us,disk,600,Orange&#44 hazy light that was moving very quickly then dissaperd.
05:00.0,powers lake,wi,us,fireball,300,Three large fireballs hovering in the sky for at least 5 minutes&#44 then raced to the south.
17:00.0,harrodsburg,ky,us,triangle,8,Bright Triangular lights seen over Harrodsburg&#44 KY.
45:00.0,winchester,ca,us,sphere,300,two stars rotating tightly together as they fell slowly not a min later the direction slightly changed and it looked as if it projected
25:00.0,felton,de,us,triangle,900,Three triangular objects with rotating&#44 colored lights appear in the western night sky over a mid-Atlantic town.
00:00.0,big sur,ca,us,unknown,900,Slow moving&#44 silent large blinking red light less than 1/2 mile from me heading south over Pacific Ocean.
12:00.0,shreveport,la,us,oval,660,1st  at 6:13 a.m.&#44 Shreveport&#44 LA.  2nd  6:15 a.m.&#44  3rd sighting&#44 6:19 a.m. Slow moving&#44 no noise&#44 oval&#44 we think&#44 red &amp; white lights
20:00.0,richfield,wi,us,unknown,900,Thought I was photographing Chemtrails.Then comes the 90 degree turn. Wild This was over South East Wi. Toward Mitchel field around
32:00.0,babson park,fl,us,circle,720,8 round objects with all yellowlights rising straight up in a diagional formation
11:00.0,bonner,mt,us,unknown,15,Light seen moving north east over I-90 at cloud level between Bonner and Potomac.
00:00.0,moreno valley,ca,us,light,120,Solid light traveled across the night sky over Moreno Valley&#44 CA.
00:00.0,huntsville,al,us,other,240,A &quot;parked&quot; 737 in the sky accompanied by an orb
15:00.0,palm beach,fl,us,light,30,Sliver of light in the sky
15:00.0,hawthorne,fl,us,unknown,5,An aircraft reflecting the sun light went behind the moon and disappeared
45:00.0,southaven,ms,us,formation,1200,5 BRIGHT WHITE ORBS THAT CHANGED IN FORMATION
19:00.0,philadelphia,pa,us,other,60,2 stars moving together separated by a distance of about 8 inches.
33:00.0,alexander,ar,us,flash,900,A Flashing strobe light occured before complete dawn. It grew brighter in size brightness and then would suddenly decrease in size and
00:00.0,ball ground,ga,us,circle,60,Possible saucer like shape sighted over Ball Ground&#44 GA&#44 USA with one bright and one dim white light&#44 and one red light. 1/2 mile long.
26:00.0,hazlet,nj,us,diamond,60,bright diamond light in the north sky&#44 turned towards the east and lights went out into a small red light and vanished.
30:00.0,portland,or,us,light,1800,Point of light traveling at high altitude with intervals of &quot;flaring&quot;.
00:00.0,glendale,az,us,light,120,Strange lights over Glendale&#44 Arizona.
00:00.0,london (canada),on,ca,disk,1200,very close encounter with what i truley cant imagine
00:00.0,francis creek,wi,us,light,3600,multi-colored pulsating UFO&#44 round white object falls out of it straight down toward the ground
05:00.0,woodbridge,nj,us,light,540,Saw two lights that were not planes.
00:00.0,seattle,wa,us,cylinder,60,Reviewing my photos I came across a suspicious object in the upper right corner and it way flying at an odd angle. Too steep for a plan
00:00.0,santa fe springs,ca,us,sphere,6,Sphere like glowing objects hovering and then traveling in an incredibly fast speed then vanishing.
45:00.0,saline,mi,us,formation,6,Southeast sky early in the evening&#44 Blue&#44 Green and Red Lights.  ((NUFORC Note:  Possible sighting of Sirius??  PD))
30:00.0,buffalo,ny,us,light,2,Fast moving light curves in sky
55:00.0,paducah,ky,us,unknown,2700,I went outside for nightly smoke break and to gaze at the night sky.  I noticed something that seemed like an out of place star only to
30:00.0,terrebonne,or,us,circle,109800,2 UFOs sighted above our back pasture...
40:00.0,wilson,nc,us,circle,4,several unidentified objects where seen on this day from my home in Wilson&#44 NC
00:00.0,mount vernon,wa,us,flash,1800,Multi color flashing lights in sky.
10:00.0,brentwood,ca,us,light,30,Bright Light fades away within 30 seconds.
45:00.0,little rock (south of),ar,us,circle,180,Round black silent object
00:00.0,atlantic city,nj,us,unknown,10,A small bright green object was flying towards the ground at an extremely low altitude and then disappeared within a 10 seconds.
50:00.0,brookhaven,ny,us,circle,60,I saw a star like object moving in swearls with light on and off
00:00.0,brookfield,ct,us,triangle,30,Small craft taking off and shooting off very fast&#33&#33
00:00.0,pensacola,fl,us,disk,360,Three red disk shaped lights seen in Pensacola.
03:00.0,ridgecrest,ca,us,unknown,15,Three to four whitish/yellowish lights lit up sequentially over southern sky of Ridgecrest&#44 California seen by 4 observers
30:00.0,columbus,oh,us,triangle,180,Craft rotating in an arch with 3 bright&#44 rapid blinking lights.
45:00.0,southbury,ct,us,fireball,600,Driving down 67 towards New Milford. Just passed Transylvania road. My wife and I saw a fireball like shape in the sky. It was bright o
00:00.0,hagerman,id,us,light,900,Yellowish white lights brighter than the north star about 10 miles over the hills in Hagerman Idaho.
43:00.0,jonesboro,ga,us,light,600,Strange lights on the Southside.  ((NUFORC Note:  We suspect that the object may be a twinkling star.  PD))
00:00.0,university park,fl,us,triangle,420,Sighting:  (ongoing) Couple of week&#8217;s duration on daily bases (required condition clear sky or few clouds).Location in the early mo
30:00.0,sacramento,ca,us,formation,45,Fleet of silver UFO trio fly north at high speed.
43:00.0,fresno,ca,us,other,60,Blackish odd shape over north Fresno&#44 CA.
00:00.0,stoughton,ma,us,fireball,60,Wow&#44 Was That Strange.
30:00.0,st. augustine,fl,us,circle,3600,I have a picture of a craft in the sky and you can see the markings on the craft.  Dub it the  &quot;Neville Pic.&quot;
00:00.0,spring hill,tn,us,fireball,300,Two orange fireball-type flying craft within 5 minutes of each other.
50:00.0,gresham,or,us,fireball,150,10 silent red &quot;fireballs&#44&quot; zoomed together&#44 configured themselves and disappeared
00:00.0,kent,wa,us,sphere,90,Three circular red objects in triangular formation
07:00.0,miami,fl,us,other,40,Saw 2 green star looking objects slowly traveled across entire sky in under 40 seconds
15:00.0,mesquite,nv,us,sphere,180,Large white sphere on the Mesa in Mesquite&#44 Nevada.
00:00.0,mcdonald,pa,us,light,3600,Bluish-white objects playing tag in McDonald&#44 PA
00:00.0,myrtle creek,or,us,light,600,several lights shaped in an s pattern moving slowly with a flashing light redish in color.Dont know if what I saw was a ufo or somrthin
00:00.0,new york city (brooklyn),ny,us,circle,8,Red green UFO or drone sighting Brooklyn
30:00.0,imperial,pa,us,light,3600,2 lights circling/chasing each other
33:00.0,huntington,wv,us,fireball,1236,Outside smoking a cigarette seen it goes straight up went over to the last for about 10 miles until we couldn&#39t see it anymore then sta
58:00.0,covina,ca,us,light,300,Fleet of multiple pulsating color spheres.
00:00.0,bellevue,id,us,fireball,900,Six orange lights with no sound in formation over Bellevue&#44 Idaho.
00:00.0,middleburg,fl,us,unknown,300,2 object reddish white hovering in the sky.
30:00.0,portland,or,us,light,3,White light moved across the sky at an unbelievable speed.
30:00.0,salt lake city,ut,us,light,600,Orange hovering lights above salt lake city.
10:00.0,oakland park,fl,us,light,540,&quot;Armada&quot; of Strange Lights Over Fort Lauderdale Area.
48:00.0,boise,id,us,circle,3,Low&#44 fast flying&#44 round&#44 very bright light&#44 no sound&#44 moving east to west over Boise Idaho.
50:00.0,charleston,sc,us,formation,600,I walked out into my yard downtown Charleston at 11:50 PM. I was with another witness that is ex-military\veteran &amp; ex-fire (he stated
23:00.0,flagstaff,az,us,cigar,120,the craft was cigar shaped looking kind of like a large blimp&#44 was at night&#44 white looking&#44 with veins of some sort on the outside of t
54:00.0,windsor,co,us,triangle,360,Upside Down Black Metalic Pyramid with non-defracting lights
00:00.0,kenosha,wi,us,other,600,Three large white lights on the underside of an mini van sized ufo at approximately 150 feet away for about ten minutes.
45:00.0,elizabethtown,ky,us,,4500,Family members witness 5 lights in sky hover&#44 &quot;jump&#44&quot; then disappear.  Several nights. TV coverage.
25:00.0,mckinleyville,ca,us,,15,Man sees two delta-shaped &quot;aircraft&#44&quot; w/ lights blinking  in sequence. Within 400 yards. Police cars nearby.
30:00.0,gustavus,ak,us,,300,Boatload of young fisherman witness very large&#44 orange obj.  It returns their light signal&#44 then zips off.
30:00.0,chatham (canada),on,ca,triangle,30,Huge&#44 Slow &#44 Silent with 7 dim orange lights in a V shape pattern passed overhead&#44 no trail or sound.
20:00.0,san antonio,tx,us,triangle,15,My girlfriend and I report seeing 7 lights in a boomerang shape object going east flying very slowly. The object was about 100 yards up
20:00.0,snohomish,wa,us,oval,1200,I saw it when I was watching the sunrise. It moved very quickly across the sky. it moved back and forth and up and down several times e
15:00.0,sharon (to brookfield&#44 oh),pa,us,changing,600,Object seen as round light initially&#44 changed colors white to yellow&#44 orange-red&#44 yellow&#44 white&#44 then split into 2 white lights with re
30:00.0,north pole,ak,us,fireball,45,White/Blue fireball object fell from the sky.
55:00.0,palmyra,mo,us,sphere,10,Bright green sphere with red trail
01:00.0,mary esther,fl,us,cylinder,60,I walked outside my garage and saw a ufo in the sky coming towards me with white flashing lights
10:00.0,albuquerque,nm,us,sphere,600,object hovered due east.flickering brightness.disapeared.reappeared in different but close proximity C130&#39s landing .
00:00.0,adrian,mi,us,oval,2,It was silver golwing and was rotating.
10:00.0,tuktoyaktuk (canada),nt,ca,disk,120,Star like UFO
45:00.0,fort lauderdale,fl,us,fireball,3,i was wallking back to the car and i saw a light off to my right in the night sky at about 45 degrees. it was greenish yellow in color
00:00.0,rockford,il,us,sphere,900,my wife and I saw a bright orange ball decending out of the east then leveling off then going about half a block then turning to the no
00:00.0,medford,or,us,triangle,2400,Bright flickering light in southwestern sky.
12:00.0,wadsworth,oh,us,triangle,900,Red lights on a triangular object with 2 others hovering paralle
50:00.0,olympia,wa,us,light,1200,Light hovers over western Olympia&#44 WA for over 10 minutes.
30:00.0,cottage grove,or,us,disk,420,they were glowing disk shaped objects
00:00.0,sniders crossroads,sc,us,unknown,60,object above the treeline with no sound
56:00.0,las vegas,nv,us,light,5,UFO
45:00.0,wheat ridge,co,us,other,420,A white horizontal line appeared in the west and moved slowly north until moving behind some dark clouds.
40:00.0,mississauga (canada),on,ca,fireball,15,We came out of a clothing store on Mavis Road in the north part of Mississauga&#44 my son my wife and my sons friend&#44 were getting into ou
50:00.0,post falls,id,us,light,1200,POST FALLS IDAHO SIGHTING 2/12/02
00:00.0,lorain,oh,us,disk,120,UFO near Cleveland Ohio&#44 evening of 2/12/02.
08:00.0,concord,nc,us,light,240,I saw a moving light  that disappeared into thin air on a clear night.
12:00.0,astoria,ny,us,light,20,i saw three ufo&#39s that  reminded me of fireflyes moving anyway  at any speed.
35:00.0,huron,sd,us,triangle,120,A triangular shape light that hovered for about 2 min and then just faded away.
30:00.0,mcveytown,pa,us,other,45,daylight sighting&#44no wind&#44 crescent-shaped object
00:00.0,seattle,wa,us,cylinder,15,2-12-03 orange fiery/glowing circular object flying above tree level  watched for about 10 seconds in Shoreline Washington
00:00.0,friend (hwy 15&#44 approx. 4 miles se of),ne,us,light,120,We were not sure if it was 1 large craft with 3 individually moving lights in a triangle formation or 3 individual crafts. But we were
02:00.0,vancouver (canada),bc,ca,triangle,180,3 lighted triangular craft (Very silent)
30:00.0,calgary (canada),ab,ca,unknown,420,Had a multycoloured pulsing strobe-light  sort of like a disco light.
00:00.0,newland,nc,us,triangle,3,Fast trianglar craft
15:00.0,port angeles,wa,us,changing,45,Ball/Cylinder shaped metallic object  hovering over Port Angeles&#44 Wa
30:00.0,burney,ca,us,disk,1800,Observance of one large and two smaller UFOs in a comparitive prolonged period of time.
00:00.0,new york city (brooklyn),ny,us,light,300,TWO BRIGHT STAR SHAPE OBJECTS AT 700PM GOING FROM SOUTH SKI TO THE NORTH AT HIGH  SPEEDS NO SOUND
30:00.0,howell,mi,us,cigar,45,Large glowing object that seemed to be  landing&#33&#33
00:00.0,chicago,il,us,oval,3900,Object hovered over electric transformer for a few minutes&#44 then quietly move over us. No sound. Aprox size of basketball held at arms
00:00.0,andover,ma,us,light,60,High altitude point of light makes high speed instantaneous 90 degree turn and  accelerates rapidly
00:00.0,monroe,in,us,sphere,20,Orange sphere or ball on US 27 in Monroe&#44 In at Coppus Corners
00:00.0,lafayette,ca,us,disk,3600,A saucer shaped craft landed in a secluded parking lot behind and below the house I was lin=ving in.
00:00.0,colorado springs,co,us,,2419200,THREE FLIGHTS OF FOUR CONTACTS ON RADAR IN 1970 AS SEEN AT NORAD&#44 CHEYENNE MOUNTAIN.
00:00.0,savannah,ga,us,circle,1200,Hazy moon like object with attachments.
00:00.0,deltona,fl,us,changing,1800,I was in boot camp at Paris Island&#44S.C. Some of the platoon was in a smoking circle as was normal every night. I noticed in the sky a l
00:00.0,orange,ca,us,flash,120,Car radio goes dead&#44 bright light.
10:00.0,simpson,pa,us,unknown,600,Hovered- Colored lights went out- sped away -left trail
00:00.0,spooner,wi,us,sphere,8,Driving almost due south through an isolated and heavily wooded section of N. wisconsin&#44 sky was comlpetely clear with  visibility at n
30:00.0,sacramento,ca,us,other,120,6 hyphen-shaped yellowish-white objects flying as group but shifting positions from NE to SW (Reno-SF) at approx. 35K alt. and 450mph.
00:00.0,eastport,me,us,cigar,120,glowing orange cigar shape light&#44 that streached like an elastic.
00:00.0,waltham,ma,us,unknown,300,Stars or satellites change places in the sky.
30:00.0,grover beach,ca,us,other,180,Grover Beach UFO coming from ocean
00:00.0,hollister,ca,us,egg,600,I was in High School just got out of late Basketball Practice.  My older brother came to pick me up and take me home.  It was late even
30:00.0,yuma,az,us,oval,600,Two on duty Military policemen observed a large flying orange oval come down from the north over the Cibola rage and  perch on a tower.
00:00.0,west palm beach,fl,us,disk,120,A beam of light that resolved into 40 to 50 flying disks&#44 outside of our atmosphere&#44 with stars seen through their formation.
00:00.0,hinesville,ga,us,sphere,1800,It was the unusual movement that made all who were observing the object consider it a UFO.
00:00.0,malden,mo,us,fireball,45,Big Orange Ball sitting in field behind house
00:00.0,los gatos,ca,us,disk,600,Entering into dusk witnessed a small round object coming North from the South.  Object darted accross the sky and finally hovered about
00:00.0,west palm beach,fl,us,triangle,14400,UFO SIGHTING 1986
30:00.0,indian springs,al,us,oval,3600,Huge craft hovering over a residential area...
00:00.0,huntsville,al,us,other,2700,Bell or thimble shaped object rises out of Guntersville Lake and follows pair into Huntsville.
00:00.0,savannah,ga,us,other,60,Siting of Vee shaped craft in Savannah GA (1998-9?)
00:00.0,shiocton,wi,us,other,3,Object was silent with a soft yellow glow to it traveling in a straight line at incredible velocity.
30:00.0,boston,ma,us,other,5,Large &quot;Gulf Breeze&quot; type object seen over Boston at about 10&#44000 feet in Winter
15:00.0,brockton,ma,us,other,600,Large Craft Hovers Over Highway in Mass
17:00.0,brockton,ma,us,triangle,240,An object stops dead in it&#39s track&#33
00:00.0,burlington (canada),on,ca,chevron,600,Chevron-shaped object encountered hovering amid a stormy winter night.
00:00.0,waterloo,il,us,formation,1800,Giant Chevron
00:00.0,calistoga,ca,us,sphere,120,Golden Orb about 3 feet across&#44 moving pretty quickly and smoothly above the hills.
00:00.0,lakewood,co,us,circle,180,First observed hovering above tree up close by my daughter age 11 &amp; her friend 12. Daughter saw window of air craft felt staired at but
00:00.0,grand rapids,mi,us,disk,300,I was taking my daughter home from the local hospital and i looked acrossed the street. I saw this circular or flat round shape with li
00:00.0,west alexandria,oh,us,triangle,1800,TRIANGULAR CRAFT NEAR WRIGHT PATTERSON AFB&#44 WINTER 1992
15:00.0,ironton,oh,us,sphere,3,No sound trail or color change it was just moving on.
00:00.0,vancouver (canada),bc,ca,triangle,120,1994 Sighting in Vancouver&#44 B.C.
58:00.0,nashville,tn,us,,10,Man saw strange light move slowly across sky&#44 stop&#44 then streak off.  10 second sighting.
30:00.0,vaiden,ms,us,cigar,300,Saw cigar shaped object in Carroll county mississippi
00:00.0,north washington,pa,us,sphere,15,Falling Sparks from Hovering light
00:00.0,phoenix,az,us,light,1200,Green&#44 almost neon color&#44 rainy night&#44 stationary object
00:00.0,sacramento,ca,us,unknown,45,This does not need to be reported&#44 nobody cares about my story anyways
00:00.0,liberal,ks,us,,8,Man reports witnessing &quot;neon light&quot; hovering in southern sky.  Obj. shoots off &amp; disappears.
00:00.0,santa rosa,ca,us,,5,Woman sees bright flash&#44 then witnesses large&#44 iridescent&#44 &quot;sparkly&quot; obj. streak north. Not meteorite.
30:00.0,lyndhurst,oh,us,unknown,600,Heard Loud&#44 roaring &#44 observed 3 strobing lights at 40 degrees above horizon &#44 20 degrees wide formation&#44  formation of lights was STAT
30:00.0,lyndhurst,oh,us,unknown,600,HEARD LOUD&#44 RUMBLING ROAR&#44 SAW 3 BLUE-WHITE STROBING LIGHTS MOTIONLESS IN WESTEREN SKY&#44  LIGHTS AT LEAST 20 DEGREES FROM END TO END&#44 NO
00:00.0,camden,sc,us,other,300,The  largest fastest moving object that I have ever seen and never heard.
00:00.0,st. albert (canada),on,ca,circle,30,A bright white object moving slowly across the sky split into 4 other craft 3 of which surrounded the white one in the middle to form a
00:00.0,la puente,ca,us,other,2,From a stand-still... to a one-second period of ignition... followed by one-second of what sounded like the after-burner of a massive-
00:00.0,north adams,ma,us,diamond,120,My wife and me were unpacking boxes in our new apartment on a hill overlooking the town. I had decided to take a cigerette break and en
